pg_id,q_num,topic,ffvalue,q_id,r_id,debate_id,source,triple_id,q_text,r_text
5,3,climate change,-2.6,143483,143488,5844,4F,-1,"You'll have to ask gnojek that. It appears he thinks that any pronouncement by a scientist suggesting CO2 production is a problem is a conspiracy theory by scientists to get bigger budgets:
 
 'As scientists we will tell you that there is a major problem that can only be solved through science , which can only be done with money. We're scientists and we really like grant money to do research. Wouldn't it be great if we had a global initiative to fund this research indefinitely, or until the global warming problem is solved...'
 
 It's the YEC movement all over again: there's no proof, the evidence could be interpreted either way, it's a scientific conspiracy theory, the Devil is behind it: it's un-Christian to cut back on fossil fuel burning etc emoticon_xclown","Ah, my bad... :p"
5,4,abortion,5,66988,67244,3177,4F,-1,"Obviously, you can't please everyone!! That is just a story of one person. Why didn't you cite the statements of millions of Iraqis who praise our help in removing their totalitarian leader?","Actually the kid was on a panel, all pretty much saying the same thing. 
 
 Why didn't YOU cite them?"
5,5,evolution,-4.6,70796,70837,1499,123,6634,"I am 50% sure that God exists and 50% sure that he doesn't. Woo hoo.
","well that won't help you when you go to hell...Woo hoo
"
6,1,death penalty,-2.833333333,57964,57974,2730,4F,-1,"I have had some experience with this topic...
 My father was murdered when I was 12, the perp was convicted a year later and was charged with 1st degree murder and sentenced to death..
 flash forward 24 years
 He ran his course of appeals and every legal proceeding you can imagine. His lawyer after 20 years of him being on death row came up with 'retardation'
 Mind you he 'walked' 3 times.. all of which I was there to witness. I was to be a witness to the execution by request of my grandmother who has passed on. anyway at the last minute he got a stay of execution. Back to the drawing table.. Last year after several hearings, they came to the conclusion the he was mentally retarded..scoring a 75 on his IQ test. The limit for the death penalty is 70. He was a high school graduate, had a family, held jobs.. and clearly competent, nonetheless they found him otherwise. So now he is off death row, and the DA has told me that it is possible he could get parole eventually. With all that it has been a very trying time for me and I have had to struggle with how I really felt about the death penalty. I have been a supporter but never really could my put heart into my conviction. I do not know if it is out of revenge or not, hard to say I am too close to the matter. But I did feel let down when they took him off death row, now I feel like there will never be justice. I put so many years of waiting for that moment... it sounds kind of sick, but as much as I dreaded witnessing it, I also looked forward to it.
 I do think that maybe life in prison may be better, only if his experience there is just awful....
 but the revenge side of me, just wants him to suffer what my father suffered. but if you were to ask me to think about this the old fashion way, which would be I should be the one to flip the switch .. not so sure I could do it.
 so with all that I still don't really know if I in my heart, support the death penalty or I am just after revenge.
 The victims of violence I would imagine go through this struggle.
 Side note... the man who murdered my father also killed a young girl when he was a minor... he had escaped from the correctional facility he was in.. and it was several years later when he killed my dad.","So sorry, Anastasia...that's a horrible thing to face. And now, using that excuse? What!
 
 If justice was swift for the guilty then he would not have escaped only to do it again. Some criminals never change, and via your testimony, only live to do it again.
 
 There are some who need to be put to death.
 
 Your situation made me shudder, Anastasia. But, I am glad you didn't let it (revenge) effect you to the point of taking his life yourself.
 
 If it would have been my father, those many years ago, I cannot say that I would have waited, nor would have accepted that lame excuse of retardation. I could very well be in prison myself."
6,2,gay marriage,3,50240,50303,2131,4F,-1,But how is homosexuality wrong?,"Nature doesn't allow homosexual sex to create life, to reproduce, and though humans use sex as entertainment, it obviously was meant for a greater purpose. Biology shows us we need both male and female to create life, that male and male doesn't create life, that indivdual gratification doesn't create life. If you want to attach relgious or philosophical significance to sex you may at this juncture. That is why I think it is wrong. Humanity wouldn't be around if homosexuality were the standard, homosexuals wouldn't exist without heterosexuals. You may be looking for a more fundamental 'morality' to my basis. I choose to validate my beliefs on science and years of living proof of heterosexualitie's superiority, and when I mean hetero superiority I mean strict hetero adhearance, no socially unacceptable behavior being thrown in like 'cheating' or 'rape'."
6,3,climate change,-1.8,249536,249571,390,4F,-1,"When we drive our cars, the fuel emits into the air, causing global warming.","I'll try to be nice since you wrote it in 7th grade. 
 
 
 
 Homo Sapien hasn't existed for millions of years. It would be more appropriate to say that the Earth has provided the basis for life for hundreds of millions of years. 
 
 
 
 And most of that goes into landfills....
 
 
 
 Not really. World forests are at risk for farm land and non-paper logging, not for paper which is being replaced by post consumer waste at increasing rates. Most paper people use today contains at least some recycled paper.
 
 
 
 It's not just cars and catalytic converters have greatly decreased emissions.
 
 
 
 Cereal factories aren't that big of polluters. The largest polluters are energy plants with a few exceptions like some of Alcoa's smelters which burns one of the dirtiest types of coal in the almunimum production process. And the world will go from bad to worse, from worse to horrible and from horrible to castastrphoic. Not suddenly. That's day after tomorrow fantasy. 
 
 
 
 Flooding is more a immediate problem. 
 
 
 
 No they aren't. The sun is the main source of weather through the energy transfer from light to various parts of the enviroment. 
 
 
 
 We don't actually know this for sure. There is some data but much speculation as to what is exactly causing larger and more frequent storms. The bigger problem of reducing salinity is the currents themselves and how they intergrate with migration and heat transfer. Sources of food that humans depend upon could disappear if currents drastically change. And the basis of Day after Tommorrow is correct in how the gulf stream helps regulate temperatures in Europe."
6,4,abortion,4.2,385660,385816,13742,4F,-1,Chickens have eggs.,But the point you miss is that a caterpillar is NOT a butterfly; a puppy is NOT a full grown dog; a ZYGOTE and a FETUS are NOT children.
6,5,evolution,-4.166667,384458,384480,5222,123,2173,"The Big Bang arose from a singularity not from nothing.
This is a clear sign that th reader doesn't understand cosmology or science.
Yet we are supposed to believe that a God created the universe out of nothing especially since there is no shred of evidence for a God.
This topic is covered extensively in the online monthly magazine - Science and Discovery. These folks also debunk the Bible and other religious nonsence.
The name of the organization which I suggest everyone look at is Science Club of Long Island.
","Your unenlightened state forbids it. There is nothing which will divide you from your delusion.
"
7,1,death penalty,-2,306040,306069,11057,4F,-1,"Actually, society hasn't said this. 5 judges, in very recent times, have. I for one think that some 17 year olds fully comprehend the full implications of murder, and therefore should be held accountable in the same way as an 18 year old. I guess I just don't see any reason why a jury could not address the issue on a case by case basis. I do not see the '18 and over execution rule' in the eighth amendment.","And no, it is not at all clear that this is not about abortion, Phyl, because you keep bringing the topic up. Because you declare something, that doesn't make it so.
 
 Lastly, you are asking the opinions of members of a forum here. If you want our opinions, great. If our opinions differ from some court ruling, it does not mean the opinions are wrong, it means they differ. Given your criterion, the only way to express opinions here would be if we were doing it from the bench."
7,2,gay marriage,3.571428571,313468,313479,11290,4F,-1,"1) I haven't read the Bible cover to cover. So, please cite the where the term 'marriage' is used in the Bible.","Where to start. The term Marriage appears 41 times in the NIV (New International Version). The term Marry appears 42 times in the NIV. But there are some relevant verses that speak to the rightness or wrongness of marriage in different situations; most of which refer to moral issues which is something people in this generation don't want to consider at all. For example, here the bible speaks about keeping the marriage BED pure and undefiled. 
 
 Hbr 13:4 Marriage {is to be held} in honor among all, and the {marriage} bed {is to be} undefiled; for fornicators and adulterers God will judge.
 And here is where God consecrated the relationship (Marriage) between Man and Woman through Adam and Eve. He also gave Man dominion over all the animals of the World at this time. 
 
 No where does the bible refer to gay marriage anywhere in the positive sense as the concept was never raised or dreamt of by anyone in the ancient world, homosexuals included. Only in this generation have the morals and values of society become so reprobate that these various unnatural forms of sexual perversions are seen as right and normal.
 Gen 1:28 Then God blessed them(Adam and Eve), and God said to them, 'Be fruitful and multiply; fill the earth and subdue it; have dominion over the fish of the sea, over the birds of the air, and over every living thing that moves on the earth.'Exd 22:19 'Whoever has sex with an animal shall surely be put to death.
 Sex with animals was once a death penalty offense. Today, we have web sites promoting it.
 
 Lev. 20:13 ''If a man lies with a man as one lies with a woman, both of them have done what is detestable. They must be put to death; their blood will be on their own heads.
 
 ROM 1:26 Because of this, God gave them over to shameful lusts. Even their 
 women exchanged natural relations for unnatural ones.
 
 27 In the same way the men also abandoned natural relations with women and were inflamed with lust for one another. Men committed indecent acts with other men, and received in themselves the due penalty for their perversion.
 
 32 Although they know God's righteous decree that those who do such things 
 deserve death, they not only continue to do these very things but also 
 approve of those who practice them.
 
 Now all one must do to rationally determine that God, through His word condemns the concept of homosexual marriage is to look at his attitude on homosexuality. If God considers homosexuality so unnatural an act and a death penalty offense under the OT Law, do you really believe that He thinks gay marriage is right, acceptable or normal?"
7,3,climate change,-3,363621,363638,5939,123,4915,"Around the world, thousands of scientists have devoted their professional lives to studying the climate. Not centrally organised, they sometimes build temporary affiliations but they remain scientists throughout &#8211; that is, they are independent, constantly challenge each other and are committed to searching for truth through objective, independently verifiable evidence.
Overwhelmingly, this evidence has led to four conclusions. The first is that the world is warming. The global average temperature has increased by about 0.8 degrees since 1850, with most of the increase occurring since 1950. The warming varies among decades because of natural fluctuations but the overall trend has been inexorably upward.
Warming is evident in other indicators, such as rising sea levels and reduced sea-ice and snow cover. Of these, the most important measure is the extra heat in the oceans, which is steadily rising. Claims that climate change has reversed since 1998 are misrepresentations of the full data.
The second conclusion is that the dominant cause of the warming since about 1950 is the increase in the atmospheric concentrations of greenhouse gases released by human activities, of which carbon dioxide (CO2) is the most important.
This critical conclusion is based on several independent lines of evidence, including basic physics, studies of climate changes in both in the geological past and in the industrial era, and finally &#8211; but far from solely &#8211; from the predictions of climate models. Together, these provide an overwhelming case that increasing greenhouse gas concentrations cause warming, and that CO2 is the largest contributor to the current warming trend.
Other contributors include changes in the sun&#8217;s output associated with sunspots and solar flares, and volcanic dust. However, if these were solely responsible for temperature changes since 1850, the world should have cooled over the past half-century rather than warming at an increasing rate.
The third conclusion is that warming will increase in future, if emissions of CO2 and other greenhouse gases maintain their present paths. ""Business as usual"" scenarios for future emissions lead to likely global temperature increases of up to six degrees above present temperatures by 2100.
These are dramatic temperature increases, which would be accompanied by major disruptions to food supplies, river flows and water availability, significant and ongoing rises in sea level (of up to about a metre by 2100 and potentially metres over longer times), disease threats, disruptions to ecosystems including the extinction of many species, and social and geopolitical destabilisation.
The fourth conclusion is that climate change cannot be reversed for many centuries, because of the massive heat stores in the world&#8217;s oceans. Even if CO2 and other greenhouse gas concentrations were stabilised today at their present levels, a further warming of at least 0.6 degrees would inevitably follow (on top of the 0.8 degrees observed since 1850) and sea-level rise would continue for centuries to millenniums.
These four conclusions have been known and agreed among thousands of independent climate scientists for more than a decade. However, new findings suggest that the situation is, if anything, more serious than the assessment of just a few years ago.
The heightened concern among climate scientists arises from a growing realisation that climate change can be accelerated beyond current predictions by reinforcing ""climate feedbacks"", which contribute to climate change and are accelerated as it occurs, thus causing climate change to feed on itself. When these feedbacks are sufficiently strong they become ""climate tipping points"" which can flip the climate into a new state with essentially no way to recover.
Several feedbacks are of immediate concern. Interactions between climate and the earth&#8217;s carbon cycle (the exchange of carbon between the atmosphere, the land and the oceans) will act to accelerate climate change if sinks do not keep pace with emissions (as is already happening) and/or if previously stable carbon stores are released to the atmosphere under climate change, for example by the thawing of carbon-rich frozen soils.
Accelerated polar warming will cause loss of ice and a consequent darkening of the surface, leading to more heat absorption and faster warming. Atmospheric concentrations of aerosols (tiny particulates) are likely to decrease in future as nations improve air quality, leading to accelerated warming as the cooling effect of aerosols is reduced.
Oceans are becoming more acidic as a consequence of increased CO2 in the atmosphere. When CO2 concentrations exceed levels to be reached by 2035 under business-as-usual emissions scenarios, there will be severe disruptions to marine ecosystems (including the Great Barrier Reef and ocean food chains), which will endanger fisheries and weaken the uptake of CO2 by oceans.
Temperature rises of two to three degrees (or higher) carry a high risk of irreversible decay of the Greenland ice sheet from surface warming alone, leading to a sea level rise of up to about seven metres. Destabilisation of the West Antarctic Ice Sheet would cause a further few metres of sea-level rise.
A climate conference in Copenhagen in March concluded that societies were highly vulnerable to even modest levels of climate change, with poor nations and communities particularly at risk. Temperature rises above two degrees will be very difficult for contemporary societies to cope with and will increase the level of climate disruption through the rest of the century.
All of these concerns are firmly grounded in science. They have led the great majority of climate scientists to conclude (paraphrasing the summary of the Copenhagen conference) that rapid, sustained and effective emissions reductions are required to avoid &#8216;&#8216;dangerous climate change&#8217;&#8217;, regardless of how it is defined.
Higher future emissions increase the risk of crossing climate tipping points and they increase the likelihood that the long-term social and economic costs of both adaptation and mitigation will be higher.
This article was written by Michael Raupach and John Church, CSIRO; David Griggs, Amanda Lynch and Neville Nicholls, Monash University; Nathan Bindoff, Antarctic Climate and Ecosystems Co-operative Research Centre; Matthew England and Andy Pitman, University of NSW; Ann Henderson-Sellers and Lesley Hughes, Macquarie University; Ove Hoegh-Guldberg, University of Queensland; Roger Jones, Victoria University; David Karoly, University of Melbourne; and Tony McMichael and Will Steffen, Australian National University.
Climate change poised to feed on itself - Opinion - smh.com.au
","Well, I am in good company.
See you in hell then before it freezes over.
Gee! the power of the documentary, it caused global cooling. so the pen is mightier than CO2
"
7,4,abortion,4.2,84195,84261,4019,4F,-1,"'Life threatening condition that is always physically harmful'? What a giant load of steamy BS. Rarely is pregnancy physically harmful and even rarer is it life threatening. There are over 6 Billion people on this earth today. If motherhood was so damn dangerous, don't you think the population would be a lot lower, even if it was just due to mothers keeling over after giving birth? 
 emoticon_rolleyes 
 Where do you get this BS from, Planned Parenthood?","Pregnancy is ALWAYS physically harmful. You try carrying a load of extra weight about and see what that does to your heart. It is also always life threatening - women still die from it and you never know how childbirth is going to go.
 
 These are the normal, frequent or expectable temporary side effects of pregnancy: 
 
 -- exhaustion (weariness common from first weeks) 
 -- altered appetite and senses of taste and smell 
 -- nausea and vomiting (50% of women, first trimester) 
 -- heartburn and indigestion 
 -- constipation 
 -- weight gain 
 -- dizziness and light-headedness 
 -- bloating, swelling, fluid retention 
 -- hemmorhoids 
 -- abdominal cramps 
 -- yeast infections 
 -- congested, bloody nose 
 -- acne and mild skin disorders 
 -- skin discoloration (chloasma, face and abdomen) 
 -- mild to severe backache and strain 
 -- increased headaches 
 -- difficulty sleeping, and discomfort while sleeping 
 -- increased urination and incontinence 
 -- bleeding gums 
 -- pica 
 -- breast pain and discharge 
 -- swelling of joints, leg cramps, joint pain 
 -- difficulty sitting, standing in later pregnancy 
 -- inability to take regular medications 
 -- shortness of breath 
 -- higher blood pressure 
 -- hair loss 
 -- tendency to anemia 
 -- curtailment of ability to participate in some sports and activities 
 -- infection including from serious and potentially fatal disease (pregnant women are immune suppressed compared with non-pregnant women, and are more susceptible to fungal and certain other diseases) 
 -- extreme pain on delivery 
 -- hormonal mood changes, including normal post-partum depression 
 -- continued post-partum exhaustion and recovery period (exacerbated if a c-section -- major surgery -- is required, sometimes taking up to a full year to fully recover) 
 
 These are the normal, expectable, or frequent PERMANENT side effects of pregnancy: 
 
 -- stretch marks (worse in younger women) 
 -- loose skin 
 -- permanent weight gain or redistribution 
 -- abdominal and vaginal muscle weakness 
 -- pelvic floor disorder (occurring in as many as 35% of middle-aged former child-bearers and 50% of elderly former child-bearers, associated with urinary and rectal incontinence, discomfort and reduced quality of life) 
 -- changes to breasts 
 -- varicose veins 
 -- scarring from episiotomy or c-section 
 -- other permanent aesthetic changes to the body (all of these are downplayed by women, because the culture values youth and beauty) 
 -- increased proclivity for hemmorhoids 
 -- loss of dental and bone calcium (cavities and osteoporosis) 
 
 These are the occasional complications and side effects: 
 
 -- hyperemesis gravidarum 
 -- temporary and permanent injury to back 
 -- severe scarring requiring later surgery (especially after additional pregnancies) 
 -- dropped (prolapsed) uterus (especially after additional pregnancies, and other pelvic floor weaknesses -- 11% of women, including cystocele, rectocele, and enterocele) 
 -- pre-eclampsia (edema and hypertension, the most common complication of pregnancy, associated with eclampsia, and affecting 7 - 10% of pregnancies) 
 -- eclampsia (convulsions, coma during pregnancy or labor, high risk of death) 
 -- gestational diabetes 
 -- placenta previa 
 -- anemia (which can be life-threatening) 
 -- thrombocytopenic purpura 
 -- severe cramping 
 -- embolism (blood clots) 
 -- medical disability requiring full bed rest (frequently ordered during part of many pregnancies varying from days to months for health of either mother or baby) 
 -- diastasis recti, also torn abdominal muscles 
 -- mitral valve stenosis (most common cardiac complication) 
 -- serious infection and disease (e.g. increased risk of tuberculosis) 
 -- hormonal imbalance 
 -- ectopic pregnancy (risk of death) 
 -- broken bones (ribcage, 'tail bone') 
 -- hemorrhage and 
 -- numerous other complications of delivery 
 -- refractory gastroesophageal reflux disease 
 -- aggravation of pre-pregnancy diseases and conditions (e.g. epilepsy is present in .5% of pregnant women, and the pregnancy alters drug metabolism and treatment prospects all the while it increases the number and frequency of seizures) 
 -- severe post-partum depression and psychosis 
 -- research now indicates a possible link between ovarian cancer and female fertility treatments, including 'egg harvesting' from infertile women and donors 
 -- research also now indicates correlations between lower breast cancer survival rates and proximity in time to onset of cancer of last pregnancy 
 -- research also indicates a correlation between having six or more pregnancies and a risk of coronary and cardiovascular disease 
 
 These are some less common (but serious) complications: 
 
 -- peripartum cardiomyopathy 
 -- cardiopulmonary arrest 
 -- magnesium toxicity 
 -- severe hypoxemia/acidosis 
 -- massive embolism 
 -- increased intracranial pressure, brainstem infarction 
 -- molar pregnancy, gestational trophoblastic disease (like a pregnancy-induced cancer) 
 -- malignant arrhythmia 
 -- circulatory collapse 
 -- placental abruption 
 -- obstetric fistula 
 
 And a few more permanent side effects: 
 
 -- future infertility 
 -- permanent disability 
 -- death.
 
 And I'm sure I've missed some."
7,5,evolution,-3.6,330795,334555,6810,123,6423,"Incapable of arguing without relying on the fallacy of changing the subject, false dichotomies (if not A, therefore B), and generally unable of actually discussing their beliefs on those beliefs' merits?
","You mean Intelligent Design, and straight forward logical, rational, common sense arguments that require reason to move to the next step, instead of ideological consensus... huh? go figure... Proponents of ID usually don't argue religiosity or scripture, they let the empirical evidence prove it, funny... that is what true science has always done. Verify the obvious, not ignore it in favor of some mindless postulations [oddly] convenient to how someone wants to live their life; amazing how that works out...
"
8,1,death penalty,-1.714285714,70399,70408,3375,4F,-1,"I don't agree with capital punishment because I believe all people have a right to life but I have to agree that the greater punishment for criminals is to keep them alive. Death is quick and easy, a life forced to live with what you have done is far greater punishment. Let them rot in a cage for the rest of their natural lives.","But if a loved one were murdered for simply protecting his/her family, what would life in prison do for justice? For you? For the low-life - but maybe get him paroled for some pacified, gutless reason/excuse?"
