pg_id,q_num,topic,ffvalue,q_id,r_id,debate_id,source,triple_id,q_text,r_text
13,5,evolution,4,339509,339579,7670,123,1941,"Putting cytosine deamination to work: How the immune system exploits the optimal properties of the genome for antibody diversification and immune function.
The effect of cytosine deamination on a random pool of amino acids and how it might facilitate evolution has been described. The optimal features of the genetic code are exploited by the vertebrate immune system by ""putting cytosine deamination to work"". Antibody diversification is crucial in limiting the frequency of environmentally acquired infections and thereby increasing the fitness of the organism. Initial diversification of antibodies is achieved by assembling variable (V), diversity (D) and joining (J) gene segments (V(D)J recombination) by non-homologous recombination. Further diversification is carried out by somatic hypermutation (SHM) and Class Switch Recombination. Central to the initiation to these diversification processes is the activation-induced cytosine deaminase (AID) protein. AID deaminates cytosine to uracil in single stranded DNA (ssDNA - arising during gene transcription) and is dependent on active gene transcription of the various antibody genes. The induced mutation is resolved by at least 4 pathways (Figure 1):
1) Copying of the base by high-fidelity polymerases during DNA replication.
2) Short-Patch Base Excision Repair (SP-BER) by uracil-DNA glycosylase removal and subsequent repair of the base.
3) Long-Patch Base Excision Repair (LP-BER)
4) Mismatch repair (MMR)
Link to big picture
http://mybroadband.co.za/vb/picture....pictureid=1884
Figure 1: Activation induced cytosine deamination and the pathways involved in resolving the induced mutation. 1) Normal DNA replication results in a C:G&#8594;T:A transition. 2) Successful SP-BER resolves the mutation, however the recruitment of error-prone translesion polymerases results (e.g. REV1) in transversions (REV1; C:G&#8594;G:C) and transition. 3) LP-BER can also resolve the mutation, however recruitment of low-fidelity polymerases (e.g. Pol n) also causes transition and transversion mutations. 4) MMR repair can also resolve the mutation, however the recruitment of low-fidelity polymerases through this pathway is a major cause of A:T transitions.
AID causes somatic hypermutation and its activity is limited to the certain genetic regions of the immune system. When the system runs unchecked, mutations might be introduced into proto-oncogenes, resulting in possible cancerous growth. The system is controlled (Figure 2). The activity and gene expression of AID is controlled. The type of error-repair pathway and the subsequent recruitment of various low-fidelity polymerases determine the type of mutations after the repair process and these also seem to be controlled. Current research focuses on the mechanisms of control of downstream repair pathways and why this system is selectively targeted to the small region of antibody genes.
http://mybroadband.co.za/vb/picture....pictureid=1886
Figure 2: Controlled variability of somatic hypermutation.
Thus, the immune system exploits the properties the genetic code for the purpose of controlled variability. This system is not only limited to vertabrate. Cytosine deamninases are found in bacteria as well. Error-prone repair systems are also present together with an optimal code.
References:
Peled JU, Kuang FL, Iglesias-Ussel MD, Roa S, Kalis SL, Goodman MF et al. The biochemistry of somatic hypermutation. Annu Rev Immunol. 2008;26:481-511.
Teng G, Papavasiliou FN. Immunoglobulin somatic hypermutation. Annu Rev Genet. 2007;41:107-20.
Goodman MF, Scharff MD, Romesberg FE. Abstract AID-initiated purposeful mutations in immunoglobulin genes. Adv Immunol. 2007;94:127-55.
Basu U, Chaudhuri J, Phan RT, Datta A, Alt FW. Regulation of activation induced deaminase via phosphorylation. Adv Exp Med Biol. 2007;596:129-37
","Speaking of antibody diversification:
Evolution In Action: Our Antibodies Take 'Evolutionary Leaps' To Fight Microbes
Wonder what the reaction would be if the title was:
Teleological Evolution in Action: Our Antibodies Take 'Evolutionary Leaps' to fight Microbes
Why Teleological evolution? Well, the immune system purposefully manipulates information by using the optimality of the genetic code, random variation and selection as a means to an end? antibody diversification. (See how)
Teleological evolution is not limited to the immune system.
Somatic evolution of malignancy alse seem to have a teleological streak
Adaptive landscapes and emergent phenotypes: why do cancers have high glycolysis?
Somatic evolution of malignancy:
The purposeful manipulating of information by using the optimality of the genetic code, random variation and selection as a means to an end? adaptation to hypoxic and acidic fitness landscapes.
Viewing cells as computers that make other computers and information as an irreducible property of nature makes this view tenable.
"
14,1,gun control,4.833333,248501,248783,5787,123,1023,"sorce http://www.breitbart.com/news/na/paF...ubstitute.html
","So the argument there seems to be that gun crime has been rising despite the strict gun laws of England. The statistics show both a rise and fall in gun crime:
""In the year ending 31 March 2005 provisional figures show a:
""16% reduction in the use of handguns
9% reduction in robberies involving firearms
6% reduction in serious injuries from firearms offences
Despite these figures, the number of overall offences involving firearms has been increasing each year since 1997/98. And crime involving imitation weapons was up 55% in 2004-05 compared to the previous year. (Source: Crime in England and Wales 2004/2005)
""Also of concern is a rise in the number of young people carrying real or imitation firearms in an attempt to boost their image or from a mistaken idea about self-protection.""
http://www.homeoffice.gov.uk/crime-v...ime/gun-crime/
In addition, the rise in gun crime may be mostly due to the big rise in the number of replica and air guns being used in crime:
""Imitation weapons were used in 3,332 offences in 2004/05, an increase of more than half (55%) from 2003/04....Ball-bearing (BB) guns are easy to purchase and often look like real weapons....Anti-firearms campaigners would like to see much tighter controls for all other types of weapons, including an outright ban on the production, sale, and possession of BB guns, airguns, and replica guns....The police say that in 2003 replica firearms were used in an estimated 60% of robberies and four out of five of all firearms offences. Nearly three quarters (72%) of firearms seized by the Metropolitan Police Service in 2003 under Operation Trident, set up to tackle gun crime within London?s black communities, were replicas, air guns, or starter pistols.""
http://www.crimeinfo.org.uk/servlet/...ory=factsheets
"
14,2,gay marriage,-3.333333,67626,67645,8476,123,6432,"By 78%, Louisianna voters decided to ban gay marriages and not to recognize gay marriages performed in other states.
There is hope for the world!
...
http://www.foxnews.com/story/0,2933,132840,00.html
Louisiana already has a law stating that marriage can be only between a man and woman, but supporters of the amendment want to protect that law in the Constitution. The amendment also would prohibit state officials and courts from recognizing out-of-state marriages and civil unions between homosexuals.
...
","Why would denying rights to a group of the population make you so happy. That is sick! Why would yu be against gay couples having domestic partnerships. This in fact means anyone who had a domestic partnership and health benefits will now lose them causing undo hardship on law abiding, tax paying citizens.
Again this is a popularity contest with these ammendments things. If we had put slavery and inter-racial marriage to an ammedment they would have passed as well. Popularity doesn't make something moral or constitutional. Will these ammendments stand up to a challenge in the courts later?
"
14,3,climate change,2.2,12157,35318,821,4F,-1,"Like I said, if that were true it would have happened 4000 years ago when our planet was a whole lot hotter.","Ice is stilll ice at -30 or -40. I agree with your point that the earth will not flood, however, your justification is bogus. You also forget that with a temperature increase comes an increase in volume, its not the ice that people are worried about. Furthermore, certain currents are based on regional ocean temperatures and are responsible for the moderate climates in various areas (Britain for one)."
14,4,abortion,-4.2,86840,87003,4734,123,5320,"ok, first of all, the ""baby"" isn't really a baby yet. and i'm not really such an expert on this whole science thing, but the researchers must have their reasons for not using the dead babies' stem cells. maybe they don't work. and also, think about this: if u had a very close friend or relative who's affected by a disease that cud be cured by stem cell research, wudn't u want stem cell research to happen? wat wud probably be more important, a very great person who's going to die pretty soon, or using things that aren't babies yet to help that person live longer. i wud choose to have that person live longer. i know, it's a rather selfish thought, but wat can i say, people are just like that. can't really deny it.
","oh really? so u wud choose 2 have...say...a close friend or relative who has a disease that wud probably be cured by stem cell research, 2 die from it and choose 2 have a new baby be born, right? well then, wat if it's ur mom or dad?
"
14,5,evolution,4,282967,283244,4244,123,2715,"ridiculous. Do we accept the genetic code? The existence of mutations? C'mmon. The question is not whether these exist, it's if the given mechanism given by darwinists is scientifically valid. I've asked repeatedly for an example of a mutation that beneficially alters phenotype and have yet to receive one. I don't deny mutations....I deny they play the role evos say they do. Likewise I do not deny the genetic code, I just deny it could have been built up the way darwinists say.
You're also asking if we reject physics? Physics is not a precise, definable science...so there's nothing to accept or reject -- it's all an interpretation or an opinion....Likewise, life is not precise or definable. The big bang is not a scientific fact -- it's simply an interpretation of the available evidence...but some people read the evidence in a completely different way and ackowledge that the big bang has some big holes in it. I don't accept ToE because I don't believe life is inherently accidental....and I don't believe variation arises randomly. Likewise there is no scientifically-proven cases of selection. Likewise there is no evidence in the fossil record of slow, gradual evolution from one species to another -- which has been the story for the past century. Likewise there are no half-ape/half-humans unearthed. Likewise there is no materialistic origin of life. I'll stop there, I guess.
","I don't recognize this version of physics, and I don't know where to begin to ask you to explain it. I'm going to take a stab in the dark, and begin with my notion of definable science. In physics, there are a number of foundational theories, including Newton's version of mechanics and gravity; the corpuscular and wave theories of light; Clerk-Maxwell's theory of electromagnetism; the luminiferous ether; statistical mechanics; thermodynamics; Special Relativity; General Relativity; Quantum Mechanics; The Standard Model; Quantum Supergravity; String Theory. That's not all, but it is sufficient for our discussion. Some of these theories are still held, some have been completely discarded, and some are currently in question at the margins. For example, General Relativity and Quantum Mechanics are fundamentally incompatible at the energies (=temperatures) of the Big Bang or the core of a Black Hole.
All of this, to me, is quite well-defined in several ways. Each theory can be clearly stated. The main evidence for and against each theory can be clearly stated. The history of each theory is well known. The history of physics, in the sense of which combination of theories is generally accepted, is also known. There are some notable errors and unprofitable side paths along the way, and there are brief transitions when the acceptance of one idea is going down, while another is rising to supplant it.
You have something else in mind. Please tell me what it is.
"
15,1,death penalty,2.16,338238,338244,12157,4F,-1,Why do we need doctors for this anyway?,"Just a guess on my part. But it's probably one of the only factors that separates our advanced industrialized nation -- as the only one still having the death penalty -- from savage places like Afghanistan, etc.
 
 Having a doctor allows the self-deceptive veneer that a most uncivilized, inhumane act, about to take place, is somehow civilized or humane. And not the bloodthirsty, venomous, purely vengeful thing that it is.
 
 He sounds like a very principled individual to me. With this, yet one more indication that the death penalty system in our country is unsustainable. Not only for moral reasons, but because it is not shown to serve as an effective deterrent, and because the overwhelmed system is not supportable, under our American Constitution, often punishing everyone involved, even the families of victims. (i.e. These cases go on for years and years and years and years. There's no closure for people.)"
15,2,gay marriage,3.2,187460,187471,7150,4F,-1,"It says right in the Constitution...
 
 'We hold these truths to be self evident that all men are created equal, and that they are endowed with certain unalienable rights, life, liberty, and the pursuit of happiness...etc. etc.''
 
 Wouldn't one gay man marrying another be considered a 'pursuit of happiness'?
 Just my thoughts.","That is the declaration of independence not the constitution.
 
 I can go you one better admendment 9 and 10 talk about certain rights retained by the people.
 
 Amendment IX
 
 The enumeration in the Constitution, of certain rights, shall not be construed to deny or disparage others retained by the people. 
 
 Amendment X
 
 The powers not delegated to the United States by the Constitution, nor prohibited by it to the states, are reserved to the states respectively, or to the people.
 
 The conservatives would argue that by offering same sex marriage that their persute of happiness is denied by gay people even existing and that they have to look at us."
15,3,gun control,-3.8,318441,318453,3822,123,3526,"If your government bans guns, then they don't trust you with them. They know that should they pass any laws that an armed populace deems as unjust, then the citizens will have the means to rise up against tyranny.
If a government bans guns, that is strongly indicitive that they don't trust us ordinary dirtbags with them, and if their ""safety"" comes at the cost of ours, then too bad.
Also, you must note that politicians own guns themselves, and have armed bodyguards. If a politician intends to ban guns, then there is indication of an inflated ego, he/she has the ""I'm more trustworthy than you."" attitude. This idea is nothing short of elitism, hypocrisy, and fear of a people who refuse to be slaves to the government.
Of course, I'm not saying that all governments that ban guns are dictatorships, but if your government bans guns (or already has), then you have to wonder what they think of you.
","This is all totally irrelevant. You're missing my point, obviously. This is all hypothetical, though I'm sure once my side post here they'll all agree that it has some validity.
Do they keep you in ignorance over there? It's not illegal for UK politicians to own guns.
"
15,4,abortion,3.2,130925,130959,5469,4F,-1,The fact you always ignore is your not just doing it to your body.....,"This is a separate issue, Voice of Reason. Some didn't understand how pro-choice people can say they personally wouldn't do something and/or think something is wrong but still support other's right to do it, and that's what I was answering."
15,5,evolution,-3.8,172884,172946,3812,123,6433,"We have found fossilized t-rex footprints. They put one foot in front of the other, just like we do.
","Everybody sing along...
Put one foot in front of the other,
and soon you'll be walking 'cross the floor;
put one foot in front of the other,
and soon you'll be walking out the door.
(Or something like that).
And let's continue...
I'm Mr. Heat Miser, I'm Mr. Sun,
I'm Mr. Green Christmas, I'm Mr. hundred-and-one.
They call me Heat Miser, whatever I touch
starts to melt in my clutch ... I'm too much
(or something like that)
"
16,1,death penalty,-1.3,212703,212887,8109,4F,-1,"No, for the reasons stated above and one more. Some people don't deserve to live....like SH, for example.","Well, it also deprives that person of rethinking their life, and maybe become a missionary for children in Afirca or something. You cannot judge a man's life on what he has done, you can judge him about those acts, but not his entire life.
 The death penalty is a contradictory measure. On one side, we say we want to protect the value of human life by putting murderers in jail, but on the other, we show utter contempt for that same value. How can you say you are protecting the life of your citizens (because you value it), while at the same time you end someone else's life. This is absurd.
 The decision on who deserves to live is not one that can be made with justice by any court on earth. Human life is a value so absolute that to play with it and destroy it is to deny the very foundations of any society: peace and respect fo the human perosn.
 "
16,2,gay marriage,3.2,131794,131811,5491,4F,,"The only state is Mass. and unless you use a friend's address, they won't marry out of state couples.","So sorry; I have a friend who works and lives in the D.C. area, but he has residency in Mass., because he owns a home there. And he was able to be married only because he owns a home there ? emoticon_rolleyes"
16,3,gun control,-4,407732,407960,1664,123,3915,"""Researchers from Knox College find that male college students who held a gun rather than a child's toy for 15 minutes had elevated levels of testosterone and added three times as much hot sauce to a glass of water that another test subject subsequently had to drink.""
Richard Morin - Perfect 10s and the Odds of a Pink Nursery - washingtonpost.com
"" 'The finger pulls the trigger,' says Leonard Berkowitz, an emeritus professor of psychology at the University of Wisconsin. 'But the trigger may also pull the finger. It's not just that having a gun is a convenient way of settling an argument. The weapon itself is a stimulant to violence.'
""Berkowitz has studied the 'weapons effect' for more than 40 years. 'There's no dispute,' he says. 'Even the sight of guns, which people think of as objects that can hurt others, can induce aggressive ideas. A weapon can function as a conditioned stimulus, eliciting both the thoughts and motor responses associated with its use.' ""
WHY GUNS SHARE THE BLAME - TIME
","Anybody who thinks guns have a phallic aspect is obsessed with sex and needs serious mental help.
Dealing with a designated nuisance species isn't the same thing as hunting. It's wildlife management.
"
16,4,abortion,3,136013,136071,5629,4F,-1,a) the amount of abortions would be static,"Actually, a few studies I've seen suggest exactly that. Looking at the birth rates among the various ethnic groups, and correcting for better birth control, etc, the rate actually remained fairly constant from before the Roe v Wade decision to the years a"
16,5,evolution,-3.8,123976,124791,529,123,4457,"Man is a special creation. Even if we don't believe in God we would still not have animalistic qualities.
","I agree that man has those traits. However you are superior to no one if you say you have never stolen anything or had violent thoughts. That would simply add lying to your repertoire.
Being an atheist does not necessarily mean you are a menace to society or saying you are a Christian mean you aren't.
However I would like you to write down a list of evolutionist charities and people who turned their lives around do to atheism.
It will be a very short list.
"
17,1,death penalty,-3.16,338182,338230,7242,123,2720,"Washington prison doctor quits over death penalty
The top doctor in the Washington Department of Corrections has resigned, saying the use of medical staff to prepare for an execution is unethical.
By Adam Wilson
The Olympian
The state Department of Co","How about using veterinarians then?
"
17,2,gay marriage,3,85566,85571,4057,4F,-1,Homosexuality is deviant in the sense that it isn't 'the norm'. That doesn't mean that it can't have benefits that outweigh its 'abnormal' nature. I'm a very strong advocate for kids and I believe that any loving couple is better than a single parent home or similar.,"You mentioned here that same-sex marriage may have benefits which outweigh its 'abnormal' nature. I must point out that even if we consider it abnormal, there is no reason to suggest that abnormal is somehow bad. In a free and equal society, abnormal deserves all the rights and privleges thet normal receives. Any benefits that exist in allowing same-sex marriage aren't being weighed down by abnormality.
 
 [QUOTE]The concept of equality is a lot easier to conceptualize than to put into practice. We, as a society, preach equality in principle, but practice inequality in all aspects of our lives. As I mentioned above, the tax code is a great example of institutionalized inequality. Businesses practice institutionalized inequality daily. For example, I am considered, by my employer, to be an HCI (highly compensated individual). As a result, I pay a much higher rate for the same healthcare coverage that my fellow employees get. Is that fair? I guess as I get older, I worry less about abstract concepts that sound good in theory but don't exist in practice.[QUOTE]
 
 Well, I won't argue that we will never be truly equal, and I won't argue that equality is the answer to everything, but I will argue that equality is worth striving for and that equality does exist in practice, it is just so ingrained into our mindset that we forget it is there. Compare US law to the laws of Europe before the revolution. In Europe there existed classes of nobles with extra rights under the law as well as kings and royalty with even more rights. As you went higher up in class, you'd get more and more political power. In America, we all have one vote. We all have an equal ability to participate in government. It is true that we use that vote to choose someone to make decisions for us in the government, but our ability to participate in government set a new precedent in equality. Consider even slaves or women's rights. These are cases where equality won out not just in theory but in practice. I will admit that we cannot simply just make everyone equal in every way, but we do our best to give them equal rights and equal represenation. In the case of same-sex marriage, I can think of no reason why we should not extend the same rights that opposite-sex couples have to same-sex couples (and plenty of reasons why we should)."
17,3,gun control,-4,18622,18628,3509,123,4734,"I think I remember seeing some post concerning that. It think it went to the affect of the buy back paid only a fraction of what the weapon was worth.
But anyways I hope it never does happen here. A voluntary buy back is fine but a forced one shouldn't be considered. I don't believe the government will make it a policy to increase gun controls to the level where it is forcing people to get rid of guns. I think they realize the 2nd amendment is strongly against this and they would get called on it.
","I think the problem is, some people believe that gun control, any gun control, is one step closer to the total surrender of all guns. My belief on this is that every time someone calls for repeal of gun control laws or opposes the new gun control laws, it fuels the anti-gun extremists to call for the total ban on all guns. If we cannot make and enforce common sense gun control laws that both sides can agree on, neither side will ever stop. If a buy back was ever proposed in America, very few guns would be sold. If guns were banned all together, only the law abiding people will give up their guns, and anyone who does not will unfortunately become a criminal.
"
17,4,abortion,3.2,140720,141020,5765,4F,-1,"Organs, a nervious system, a brain, all these are the things that make us human. Those things are not developed until 7-10 weeks after conception though (depending on your source). Many like to show proof that they start to develope earlier but again, unless something is completed and is operating then it cannot be regarded as developed. 
 
 Based on that information I would have to say that abortion should be legal until 7-10 weeks after conception. Once that time period has passed and the fetus has a functional nervious system and brain then abortion should only be reserved for the rare cases that the mothers life is in danger.","Actually they are what make us animals. It's the DNA that determines that this particular animal will be a human.
 
 There is no precise definition as to what it is that makes someone a person. An in-fetu fetus are not a person IMO even though they may well have a brain, nervous system and organs."
