pg_id,q_num,topic,ffvalue,q_id,r_id,debate_id,source,triple_id,q_text,r_text
1,1,death penalty,3.4,70327,70328,3375,4F,-1,I don't know what exactly to think of it only I think it saves us the cost of prisons!,"No it doesn't!
 
 It cost way more money in appeals than it does to excute someone. WE the taxpayers pay for legal represenatation for them and us, plus the cost of keeping them in jail. The appelas process alone costs the tax payers millions.
 It is far more expensive to kill them than to leave them in jail with no chance of parole."
1,2,gay marriage,-5,273042,273045,10106,4F,-1,"Did anyone else expect anything less? These evil fundie christianists can have affairs, 2, 3, 4, or even 5 marriages yet gay people are a threat to marriage by wanting to get married.",You hear that cry...allowing gays to marry will cause the downfall of civilization...but you never hear 'how' or 'why'? More Chicken Little ####.
1,3,climate change,4,340797,340888,12233,4F,-1,"This is where the looney left gets lost. Their mantra is atmospheric CO2 levels are escalating and this is unquestionably causing earth's temperature rise. But ask yourself -- if global temperatures are experiencing the biggest sustained drop in decades, while CO2 levels continue to rise -- how can it be true?","Because internal variability from the likes of ENSO, which can cause short term swings of a full degree C, easily swamp the smaller increase we'd expect from CO2 forcing. Easy."
1,4,abortion,-4.4,106611,106656,4804,4F,-1,"Undesired first pregnancy is an acute problem for many girls who choose to go under the surgical knife, even though that often ends up with infertility, broken life etc. Dry fasting is an alternative to first pregnancy abortion. If applied, up to 2-3 months old embryo gets dissolved after 15-16 days of the fast. Plus, there is no 'christian' sin.
 
 Vitalij",No Christian sin??? Other then the intent to kill and then doing so:p
1,5,evolution,5,74947,75019,6078,123,3569,"1. Carbon dating is not accurate.
2. Do a search on google and you'll find the information pertaining to the universities in question.
3. ""Natural selection"" is not a ""force"" behind evolution.
You do not have to believe in creationism, however, trying to convince people that your opinions are correct when they're based upon an unfounded theory is ludicrous!
You can theorise all you want but, in the end, it is all pure speculation.
As for the exact age of the earth being recorded in the bible, that's not true. The bible has recorded and predicted many events. Those who read it try to work out how old the earth is. But no where does it give an exact age - that is mere speculation, too.
http://www.answersingenesis.org/docs...bon_dating.asp
","A statement based on ignorance. Carbon dating is quite accurate. Some years ago it was accurately calibrated back about 11,000 years using dendrochronology. Prior to 11,000 years the error bars on dates became larger and larger. However, in 1998 carbon dating was calibrated back to about 45,000 years, essentially the entire useful life of the technique.
Here's how it was done. Sediment cores from the bottom of Lake Suigetsu in Japan were taken. The bottom of this lake is characterized by alternating light and dark layers - these are known as varves and one light and one dark layer is deposited each year, depending on the season. You see, the light layer is caused by the annual algae bloom. As the algae die, they settle on the bottom and form the light layer. The dark layer is made up of clay that settles as silt on the bottom during the winter. That this is true is a matter of observation - the varves are still being deposited each year and there is no discontinuity in the core that indicates that it has been otherwise in the past.
At any rate, the varves were carefully counted back to about 45,000 years ago. Samples of known age were carbon dated. Thus, by comparing the apparent age of a carbon dated sample to the actual age counted from the varves, the technique of carbon dating was calibrated for essentially its whole useful range.
You were aware, weren't you, that radio-carbon can only be detected for about 50,000 years? With more sensative instrumentation it has been detected in samples thought to be about 70,000 years old, but it isn't useful for age dating.
I don't understand why it is that if carbon dating were not useful it would matter to evolutionary theory. Does this mean that the carbon dating used by archaeologists to date artifacts in the Holy Land are wrong? Does this mean that the Dead Sea Scrolls aren't about 2,000 years old? If carbon dating is unreliable, I don't understand why Biblical scholars would make such extensive use of in in attempting to support the Bible.
I'm unclear what you are talking about.
Not sure what you mean. Natural selection is one of several mechanisms of evolution. Evolution is a change in the genetic makeup of a population of organisms over generations. Natural selection tends to decrease genetic diversity - thus changing the relative frequencies of genetic characteristics. There are othere mechanisms that also tend to decrease genetic diversity, and, of course, there are mechanisms that tend to increase it.
Those who refer to scientific theory as unfounded only make themselves look ignorant. In science, the word theory means that it has been tested. For example, there is the theory that the earth is a sphere. There is the theory that the planets orbit the sun. There is the theory that matter is made up of atoms and that the atoms are made up of protons, neutrons and electrons. There is the theory that by striking certain isotopes of uranium with high energy neutrons that the nucleus will split and release energy.
It seems strange to hear someone claim that it is speculation that the sun is at the center of the solar system. I guess it is also speculation that germs cause disease. It seems funny that ships of the Navy would put nuclear reactors in ships based on mere speculation that they can get power out of them, or speculation that they won't explode.
"
2,1,death penalty,3.8,242140,242244,7033,4F,-1,"I'm sure there have been more repeat murderers than innocent people put to death. As far as the cost goes, is that really an issue? 
 
 Execution Room = $10,000
 
 Stainless Steel Table = $2,000
 
 Leather Straps = $200
 
 Lethal Injection Chemicals = $5,000
 
 Knowing this person will never possibly be able to kill again = 
 
 PRICELESS","Actually the room, straps, and table are all multi-use. And the drugs only cost Texas $86.08 per execution as of 2002."
2,2,gay marriage,-4,333289,333313,11986,4F,-1,"and the nutty professor from UC San Diego Simon LeVay who's myopic bent to show... and who's grant was provided to show that there was a genetic cause, failed miserably in doing so. His findings were inconclusive... biased and his study groups and samples were doctored.","You have this habit of making sweeping claims with little to no substantiation.
 And even if we were to completely ignore LeVay altogether, there is MOUNDS of other evidence showing a genetic cause.
 Like I keep pointing out, but nobody on your side of the fence seems to realize, NARTH's OWN CITED REFERENCES say there is a genetic cause!"
2,3,climate change,3.2,11112,43462,390,4F,-1,"Global warming sure is a threat. Some of the Polar Ice Caps already melted. Average temperatures have rised since 50+ years ago at a constant rate. We better stop polluting now, or we will be in big trouble.","The Polar Icecaps have been melting for the past 14,000 years according to experts. Many in the scientific community believe that it would be another 100-1000 years before the melting of Polar Ice becomes a factor in the rise of sea level. What they belie"
2,4,abortion,-4.2,299873,299876,10837,4F,-1,"Steve - its not about qualifications - its about impact. Women are the ones who get pregnant, we should have more authority in the matter.","F--k'in A! right! I don't want some damn MAN deciding what's going to be legal for my body. They have NO experience with the female anatomy except what they manage to bag, they shouldn't be allowed to decide for us.
 
 They have no idea what pregnancy is like, the damage it does to our bodies and our minds, and they don't have to pay to support a child that we were forced to accept at knifepoint.
 
 Where is the logic is violating women a second time? Where's the justification for it? Doesn't the life of the unintended mother account for anything at all?
 
 Do you men have any idea of the dangerous precdent you'd be setting up with a total ban on abortion? Women who have been raped and essentially told 'You WILL have this child, you WILL carry it to term, or you WILL go to prison!' would likely commit suicide as a result, meaning that TWO lives are gonna be lost."
2,5,evolution,4.6,15221,15254,4569,123,5306,"What is evolution?
This is quite a funny post! Such a vacuous attempt at a sales pitch... let's all get comfy with evolution!
""A theory is a good theory when there is no evidence to disprove the theory and the theory makes good and useful predictions. Evolution does this.""
""What are the predictions made by evolution.""
Well, we can find oil (!) and test cosmetics on animals (!) I wasn't sure if this was meant to be funny or not. Did they not find oil before evolution? Would they not be able to tell that oil exists next to certain rocks without evolution? Why bring in animal testing? If you want to stake a claim that such cruel behaviour is part of evolution, hey, that's up to you (takes a bit of heat off us Christians over the Crusades!) (ha!)
""First and most important was when the theory was in it?s infancy, it was predicted that a mechanism would be found that would pass along characteristics from generation to generation. It took at least a hundred years but sure enough DNA and genes were found. One of the hottest areas in science is genetics with hundreds of millions of dollars being invested This along with many other predictions makes evolution a good theory""
Really, you've hit the jackpot with this one, because www.talkorigins.com claims that the 'mechanism' is still unknown... at least how the 'mechanism' works to produce macroevolution. Perhaps you should write to them!
""An acquaintance who was an oil company geologist made this statement. ?Oil companies spend millions on evolutionary geologists to find oil and not one cent on creationist geologists. Again, predictions that make evolution a good theory.""
Yes, that is an amazing statement folks. The oil companies actively weed-out geologists who are creationists, because they've been looking for oil in all the wrong places (!) (at least that's what I assume this quote means).
""Where is evolution used outside of Biology, Geology, Anatomy, Biochemistry, Embryology, and Genetics""
That's right, many of these sciences didn't exist before evolution (certainly not the first three!) (Ouch!)
""Evolutionary algorithms have been used for a number of years to design computer programs. One of the latest developments is designing electronic circuits using evolution. What is done is to start with a random design and create a population of these circuits. For the next generation, a random variation is introduced in a small subset of the population. Those that were most suitable for the job were selected and mated with some of the unmutated circuits. The next generation was still not near desired result but the process but the process continued. Each generation is closer to the desired result. After 5000 generations a working circuit was developed that even the designers did not understand how it worked. some of these circuit have received patents. You can read more about this at http://www.genetic-programming.com. As you can see the theory of evolution works in fields outside its primary field, this makes this a great theory.""
Can I restate this again... 'designing electronic circuits' ... design implies intelligence. And look, after 5000 generations we get what? A cyborg super-intelligence? Nope!
""The next time you hear someone say, ""When you see a computer (any manufactured item) you know it was designed"", you can now say it may have been designed using evolution.""
Yes, I can say that. I'll do that tomorrow at work! (ha!)
But seriously, evolution is a theory of explaining an apparent change in animals. It is not the change in animals... because that has not been proven!
","Actually, no they could not find oil without evolution. It's not only a matter of finding ""certain rocks"" associated with oil, but by reconstructing the paleo-environment. Only certain environments, indicated by types of rocks and the types of animals/plants that existed at that time, are suitable for the production of petroleum.
In fact, a lot of mineral resources are located by certain geologic formations as interpreted by modern theories of geology. Without a knowledge of biological and geological evolution prospectors would waste a lot of time looking in the wrong places.
"
3,1,death penalty,3.5,220785,217983,8109,4F,-1,"It actually saves us money. The death penalty (because of appeals) costs more than solitary confinement for life, both of which would ensure that the person would never kill again. Also I have the same question for drug users, gamblers, etc. Why make society pay to imprison them when all they are doing is hurt themselves?","Actually, the idea that the death penalty costs more than lifetime imprisonment has been disproved many times. The lowest estimate of the yearly cost for imprisoning somebody is around $22,000. The average amount of time a prisoner spends imprisoned after getting a life sentence is 60 years. Take into account the cost of building jails in order to house all these prisoners and you up the amount even more. After the average of 60 years for a life sentence, tax payers have spent $1,320,000 on ONE SINGLE PERSON. Imagine what this money could do in the education system? You said yourself, the only thing that may push the cost of the death penalty over life imprisonment is the ridiculous amount of appeals that are given. If only one appeal was given before the sentence was final, it would be far cheaper to exectue somebody than imprison them for life. How many times does a person need to prove their innocence? If they can't do it in the initial trial and after one appeal, sorry, game over...you lose. You can read more at this site:
 http://www.cwrl.utexas.edu/~tonya/spring/cap/pro5.htm"
3,2,gay marriage,-3,398005,398010,14131,4F,-1,"Don't be silly--no one is voting your family out of existence. Though it might make a fascinating Criss Angel or David Blane trick. This is simply about whether or not any group that wants to come along and redefine marriage should get to do so. I agree it's not an 'academic exercise', but not for the same reason you think.
 I no more take 'pleasure and joy' from something like this than any other public act of due process, e.g. voting to change the speed limit.
 Frankly, I've always thought it was pretty odd--if not downright disturbing--that some gay pride proponents seem to hold up the legality of their union as the determinant of their joy and emotion, when they are completely free to have whatever union they want regardless. After all, no one's going to block the door to the chapel, and I can guarantee you I'd be joyfully married with or without that piece of paper called a license.",You jsut don't get it. You act like two wolves and a sheep voting on what to have for lunch. You as a hetero get to go and get married to the person of your choice but I do not. What part of that do you not understand. You say this isn't personal and for you this is true but for me the man I love is nothing but a stranger to me in the eyes of the law. How cruel can you be
3,3,climate change,3,332443,332447,11942,4F,-1,"Global warming is nothing more than a myth that was cooked up by nature freaks who're against anything industrialized.
 
 And if that isn't true, then I don't care; we've already done far too much damage for any difference to be made now.","Hi NATO, I agree that irresponsible industrial pollution is damaging the environment and would never deny that at all. Acid Rain which is a side effect of air pollution has polluted more lakes, streams and rivers than direct dumping has and that is a direct result of heavy metals and other toxins being spewed into the atmosphere by industrial smoke stacks. So this reality goes without saying in my opinion.
 
 But environmental pollution is very different than extending the claim to the next level of Global Warming which implies that the worlds atmosphere is now incapable of repairing itself. That is the crux of this argument and if the atmosphere were so polluted that the Earth was unable to repair itself, then the air quality here in NH would be as polluted as it is in China and Russia even though we have no industrial air polluters at all to speak of here. That would be solid evidence that the volume of pollutants in the atmosphere is overwhelming the Earths ability to repair itself. But our air quality is pristine in comparison to any and all third world countries who are the largest polluters due to their lack of having any industrial pollution safeguards in place.
 
 So we must make the distinction between environmental pollution and air pollution clear because the Global Warming fraud is based specifically on the claim that air pollution is changing our weather and warming the planet, since all of the scientific evidence belies that claim."
3,4,abortion,-4,363293,363466,13045,4F,-1,"They always have a choice, whether legally or illegally. But I too hope they choose life.
 
 What disturbs me, though, are all the blacks, whites, and Hispanics who claim to be Christians, plus those who claim to be followers of the Jewish Tanakh, and who apparently think voting for a man (Obama) who is an abortion enabler, is ok with God. Have they never read Jeremiah 1:5 and Psalm 139:13, where God is instrumental in some way in creating life in a mother's womb - perhaps creating the spirit or whatever?","I highly doubt they throw them in the sink. They probably put them in a red plastic biohazard bag, tie it shut, and throw it on the pile of other red bags to be shipped off to a medical waste incinerator to be burned."
3,5,evolution,4.6,125721,125785,308,123,1436,"If life arose using carbon as its main ingredient. then is it possible that another element could be the main ingredient in a life cycle somwhere else?
Say on a planet where the temprature is a little lower and there are oceans of something that would be a gas on earth. maybe liquified xenon is pumping through the veins of a molybdneum based life form?
I dont know what would be a good substitute for carbon, I dont have a table of the elements in front of me.
","There are lot's of things that conduct electricity to some degree or another.
Polysilanes, for just one example, has a backbone of -Si-Si-Si-, and conducts because the sigma orbitals of Si are diffuse enough to overlap.
It's this de-localization of electrons that allows for conductivity.
If a carbon polymer has a lot of double/triple bonds or benzene rings then it should conduct.
Just like graphite, which is much more conductive along the a and b axes (the axes where the graphene planes lie) because of all the electronic delocalization.
But it's a poor conductor along the c-axis, because there are only weak pi-pi interactions and little orbital overlap.
Sulfur, I suppose would be a poor candidate for the basis of life.
The only times it forms more than two bonds is if it is bonded to a very electronegative atom like oxygen or fluorine. Also, it does not catenate very easily, and if it did, it would just be a chain of sulfur (no longer than 8 atoms long) with practically no functionality.
"
4,1,death penalty,3,268129,268287,9995,4F,-1,"With enough of a population size, you can check the effects of dozens of variables at once.","You can check the statistical relationship between dozens of variables, not the effects of them.
 
 For example if I correlated left hand strength with right hand strength across a billion individuals I would probably find a correlation of about 0.93, however this relationship is not causal, cutting off one hand will not result in a 90% strength reduction in the other.
 
 Correlational studies like this one can not determine cause and effect."
4,2,gay marriage,-4,85392,85416,10835,123,6008,"The understatement of the year!!
It would also further the complications of our increasingly failing schools.
","HAHAH.
School performance of students is directly related to who adults have sex with. What a funny comment.
-Mach
"
4,3,climate change,2.833333333,336611,336642,11942,4F,-1,"Those 2% included CO2 and had a number specifically attached to it. I don't remember what that number was, but if it were 'actually' showing measurable increases, why are we not all kept up to speed on how drastic the increases are? [i.e. 1970 it was 0.0123% and now it is 0.0124%].","Erm... we are? Levels of CO2 in the atmosphere are usually quoted as parts per million, currently a little over 380ppm, 150 years ago closer to 280. In 1970 about 330ppm.
 Carbon dioxide in the Earth's atmosphere - Wikipedia, the free encyclopedia"
4,4,abortion,-4,299013,302733,10860,4F,-1,We need to overturn the Roe v. Wade decision and get back to cherishing life in this country. For a country that murders it's children cannot be far from self destruction.,It's one thing that stands between us and a mindless theocracy. It protects the freedom of women from would-be ayatollahs who would make them sexual slaves.
4,5,evolution,4.4,270811,270816,8829,123,4737,"Ah good they include video clips of the altruistic behavior in chimps. Excellent idea.
","Well not exactly. The article addresses some commonality in humans and chimps with regard to altruism exhibited toward chimpanzees who are not known to the chimp exhibiting the behavior. The point was to draw a possible parallel between human altrusim which is known to go beyond mere kinship selection and the chimp behaviors which also appear to go beyond kinship-selection. The discussion goes to the fact that humans and chimps share a common ancestor at the point where humans and chimps went their separate evolutionary pathways. One possibility is that such a common ancestor may have had the capacity to also be altruistic to individuals outside its kinship group. Or of course that chimps and humans both developed their respective altruistic behaviors independently after the branch point.
None of this negates the concept of biological altruism in the form of kinship selection which a geneticall based effect. Indeed the article recognizes that chimps DO exhibit kinship selection effects!
There is of course no reason at al that one cannot have kinship selection as well as other motivators for altruistic behavior. So its rather premature to take kinship selection (which I think is what WW means by genetic altruisim) off the table just yet.
The article certainly does not draw the same conclusions as WW would have it do. Once more the rabbit hops over the actual work to his own preferred conclusion. SOP for the lagomorph.
"
5,1,death penalty,-3,26426,26492,1367,4F,-1,"We have some major flaws in our legal system. The first and foremost legal flaw is that American prisoners are American people and thus are granted first ammendment American rights. This means that murderers who don't get birthday cakes, a basketball court, tv, and a turkey for Thanksgiving go crying cruel and unusual punishment and then they get it.
 
 I've heard that the average cost of living of a capital punishment prisoner is appoximately $25,000.00 a year paid for by us.
 
 It's really bad when murderers on deathrow in Mexico are calling murderers on deathrow in America p*****s and want to transfer here.
 
 
 
 
 LEVIATHAN",You know what is far worse than murder itself? Executing people to save some money.
5,2,gay marriage,4.4,231930,236520,8922,4F,-1,"Are there any experts on Canadian or international law here?
 
 If I get married in Canada and the license is not recogised in the United states. Is there a possiblity of going to court in Canada and getting the Canadian government to to recognise marriage licenses from the United States?","Just to point out, while not reconized by the feds, NY state will reconize it.
 
 
 http://www.cnn.com/2006/LAW/10/25/jersey.samesex.ap/index.html
 
 Also, TRENTON, New Jersey (AP) -- New Jersey's Supreme Court ruled Wednesday that same-sex couples are entitled to the same rights as heterosexual couples.
 
 But the court left it to the Legislature to determine whether the state will honor gay marriage or some other form of civil union.
 
 Advocates on both sides of the issue believed the state posed the best chance for gay marriage to win approval since Massachusetts became the only state to do so in 2003 because the New Jersey Supreme Court has a history of extending civil rights protections.
 
 Instead, the high court stopped short of fully approving gay marriage and gave lawmakers 180 days to rewrite marriage laws to either include gay couples or create new civil unions. (Opinion -- pdfexternal link)
 
 'The issue is not about the transformation of the traditional definition of marriage, but about the unequal dispensation of benefits and privileges to one of two similarly situated classes of people,' the court said in its 4-3 ruling."
